movie_id,reviewer,rating,content,time
26374197,朝暮雪,4,"1.电影讲述男孩迈尔斯被受到辐射的杨永信咬了，变成磁爆步兵、雷电法王，获得“电击疗法”的技能，从而打败敌人的故事。
2.白人、黑人、男人、女人、大人、小孩，甚至猪都当了蜘蛛侠。
3.从《独立日2》到《毒液》再到《蜘蛛侠：平行宇宙》，QQ的业务已经拓展到了外国、月球，以及其它宇宙，腾讯已经称霸银河系，成为宇宙第一企业。
4.电影很戳泪点。
号称“最丝”的超级英雄都穿上了OW联名AJ1，我看着自己的阿迪王默默哭出了声。
5.一年死两次彼得帕克，每次都有新感觉。",2018-12-16 17:14:38
26374197,亵渎电影,4,看了场IMAX，非常爽，比真人版的超级英雄电影更爽，特效场面非常酷炫，而且还干净，画风就像漫画分镜直接动起来，有很多想象力和表现力爆棚的镜头，是真人电影无法达到的，这就是动画的优点，就算它画一些真人做不到的东西，你也会相信，还会觉得酷，因为它是动画有别于真人电影的魅力所在。虽然有7个蜘蛛侠，但还是噱头式的彩蛋人设，7个蜘蛛侠更是共用一个演过无数遍的老掉牙的故事，虽然无聊了点，好在视觉效果真的非常酷炫，看到这部的完成度，以后都不想看那些所谓的国产良心动画了，想追上人家这水平这业务能力，真不知道是什么猴年马月了。,2018-12-20 16:20:15
26374197,江湖遠人,4,千万不要当蜘蛛侠的Uncle，会没命的。,2018-12-22 00:48:38
26374197,桑下,5,我这是什么命！一年看两部带Peter Parker的电影，一年为他哭两次！这是海澜蜘蛛吗？！！！！,2018-12-19 05:33:11
26374197,陀螺凡达可,4,今年最好看的商业动画片，美漫改编电影的最完美形态。,2018-12-16 16:54:09
26374197,大聪,5,"斯坦李说：蜘蛛服会合身的，总有一天它会合身的。听完这话有些惆怅。影片用斯坦李这句话贯穿影片，新塑造的颓废蜘蛛侠，面具下是我们平凡人的日常烦恼，超级英雄也是人。为何要做动画片了，因为那惊奇的镜头运镜，丰富的想象力，炫彩的颜色，是真实拍摄无法比拟的。
最后字幕有彩蛋，别走开，正式开启多宇宙蜘蛛侠。",2018-12-07 00:17:58
26374197,APTX-4869,5,"我TM吹爆！这是一部看完想让人出去荡秋千的片！华纳应该来看看多个不为人所知的超级英雄的电影怎么拍！有成长有救赎有令人想哭的死亡也有令人捧腹大笑的场景（还不是妇联那种强行联动）还解决了一直以来的cp站队问题！高中组配Gwen成人组配MJ！画面太美了（这是我见过的最会玩的片头logo）（回头等bd到了截图自己打印海报去） 配乐又长又棒还经典以及各种应景（所以ost也是躲不掉的了） 最后 给那些看不起动画片的人一句""Do you have a problem with comic?""",2018-12-08 23:41:50
26374197,谢谢你们的鱼,5,太特么好看了，年度最佳动画，最佳超级英雄电影，最佳镜头设计，最佳视觉效果，最佳配乐，最佳场面设计，没想到索尼哥伦比亚居然掀起了一场全新的动画革命！,2018-12-16 16:54:40
26374197,同志亦凡人中文站,4,看过的蜘蛛侠系列最佳，漫威这是要冲击奥斯卡最佳动画的节奏啊！六个宇宙的蜘蛛侠（女）集合大作战，有成长有恶搞有热血，时不时还打破次元壁一下。Stan Lee老爷子特出的彩蛋好感人~~~~~~~~~“每个超级英雄都不孤单！”,2018-12-15 15:59:34
1307394,晚安小姐,5,爱情是一场没有尽头的虚幻追逐,2008-06-27 00:43:18
1307394,弗朗索瓦张。,4,剪辑跟分镜做得比大多数真人电影还要细致！,2009-02-05 17:17:19
1307394,颜小兽,5,太敢想了，前一刻钟都没有入戏，入戏以后觉得时间飞快。故事再复杂画面再花俏都没有关系，主题超简单，简单到想哭：我爱你，穷尽一生也要找到你。我不能向糟糕的一切投降，糟糕的标准，糟糕的规则，糟糕的世俗标签，都离我远一点。那些狂喜和剧痛，那些寻找和梦想，都是爱的代价。但我觉得值。,2011-10-05 23:58:19
1307394,A-sun*,4,剪辑要不要这么这么好。,2010-01-10 22:54:33
1307394,寂地,5,"看到后来哭得岔气了..不是悲伤的,那是让人觉得几乎有某种幸福感的温暖.不知道该如何形容.",2006-01-01 16:36:02
